{
  "schema_version": "0.1.0",
  "message_id": "msg-0001",
  "meeting_id": "meeting-demo-001",
  "phase_id": "opening",
  "event_seq": 2,
  "sender": {
    "actor_type": "agent",
    "actor_id": "agent-a1",
    "role_id": "strategic-advocate",
    "alias": "A1"
  },
  "recipients": {
    "scope": "meeting"
  },
  "identity_visibility_mode": "semi_anonymous",
  "content": {
    "raw_text": "{\"position\":\"支持\",\"reasons\":[\"可验证\"],\"risks\":[\"实现复杂度\"]}",
    "structured_output": {
      "position": "支持",
      "reasons": [
        "可验证"
      ],
      "risks": [
        "实现复杂度"
      ]
    },
    "content_type": "structured_json"
  },
  "references": {
    "message_ids": [],
    "event_ids": [],
    "artifact_ids": []
  },
  "validation": {
    "status": "valid",
    "errors": []
  },
  "accepted_by_runtime": true,
  "created_at": "2026-08-07T17:30:00+08:00"
}
